{
  "id": "medtech-bci",
  "name": "医疗器械 / 脑机接口",
  "description": "用于医疗器械、脑机接口、神经调控、康复设备和医疗软件项目的初筛。",
  "sections": ["项目定位", "产品形态", "临床与注册", "商业化", "风险与下一步"],
  "scoring": {
    "scale": ["pass", "watch", "reject"],
    "default": "watch"
  },
  "terms": [
    {
      "name": "注册路径",
      "aliases": ["NMPA", "FDA", "510(k)", "De Novo", "PMA", "三类器械", "二类器械", "注册证"],
      "description": "判断项目是否明确说明监管分类、注册路径和关键节点。",
      "evidenceRequired": "注册分类判断、已获批文件、注册检验、临床试验方案或监管沟通记录。",
      "redFlags": ["只说政策利好但没有注册路径", "分类口径前后不一致"],
      "followUpQuestions": ["当前按几类器械准备注册？", "是否已有注册检验或临床试验计划？"]
    },
    {
      "name": "临床证据",
      "aliases": ["临床", "IIT", "样本量", "终点", "真实世界", "安全性", "有效性"],
      "description": "判断项目是否已有可验证的安全性和有效性证据。",
      "evidenceRequired": "临床试验数据、IIT 记录、伦理批件、样本量、终点设计和不良事件记录。",
      "redFlags": ["只有个案展示", "没有明确临床终点"],
      "followUpQuestions": ["核心临床终点是什么？", "现有数据来自多少例患者？"]
    },
    {
      "name": "产品形态",
      "aliases": ["植入式", "非侵入式", "EEG", "电极", "算法", "硬件", "软件"],
      "description": "判断产品是硬件、软件、耗材、系统还是服务，以及医疗/消费边界。",
      "evidenceRequired": "产品架构、使用场景、硬件规格、软件功能、适应症或目标用户说明。",
      "redFlags": ["医疗场景和消费场景混用", "产品形态随融资叙事变化"],
      "followUpQuestions": ["产品最终交付给医院还是消费者？", "是否涉及植入或长期佩戴？"]
    },
    {
      "name": "商业化路径",
      "aliases": ["入院", "收费", "医保", "DRG", "DIP", "渠道", "经销商", "采购"],
      "description": "判断项目是否说明入院、收费、支付、渠道和复购逻辑。",
      "evidenceRequired": "医院试用、采购记录、收费代码、渠道协议、耗材复购或服务收入数据。",
      "redFlags": ["只讲市场空间不讲谁付费", "没有明确科室采购路径"],
      "followUpQuestions": ["首批付费客户是谁？", "是否已有收费或采购凭证？"]
    }
  ],
  "expertProfiles": [
    {
      "name": "临床医生 / 科室专家",
      "questions": ["这个适应症是否存在明确未满足需求？", "医生工作流是否愿意接纳该产品？"]
    },
    {
      "name": "医疗器械注册顾问",
      "questions": ["该产品更可能走哪类注册路径？", "临床试验压力主要在哪里？"]
    }
  ]
}
